{
  "$schema": "https://json-schema.org/draft/2020-12/schema",
  "$id": "https://schemas.example.invalid/hermesstatus/stats-v2.schema.json",
  "title": "HermesStatus 2.2 browser-facing stats",
  "type": "object",
  "required": [
    "schema_version",
    "generated_at",
    "default_device_id",
    "servers",
    "sslcerts",
    "updated"
  ],
  "properties": {
    "schema_version": {"const": 2},
    "generated_at": {"type": "string", "format": "date-time", "maxLength": 40},
    "default_device_id": {
      "type": "string",
      "pattern": "^[a-z0-9][a-z0-9._-]{0,62}$"
    },
    "servers": {
      "type": "array",
      "minItems": 1,
      "maxItems": 16,
      "items": {"$ref": "#/$defs/server"}
    },
    "sslcerts": {
      "type": "array",
      "maxItems": 256,
      "items": {
        "type": "object",
        "required": ["name", "domain", "port", "expire_ts", "expire_days", "mismatch"],
        "properties": {
          "name": {"type": "string", "maxLength": 128},
          "domain": {"type": "string", "maxLength": 253},
          "port": {"type": "integer", "minimum": 1, "maximum": 65535},
          "expire_ts": {"type": "integer"},
          "expire_days": {"type": "integer"},
          "mismatch": {"type": "boolean"},
          "error": {"type": "string", "maxLength": 256}
        },
        "additionalProperties": false
      }
    },
    "updated": {"type": "string", "pattern": "^[0-9]+$", "maxLength": 20},
    "build": {"$ref": "#/$defs/serverBuild"},
    "reload": {"type": "boolean"}
  },
  "additionalProperties": false,
  "$defs": {
    "nullableTime": {
      "type": ["string", "null"],
      "format": "date-time",
      "maxLength": 40
    },
    "server": {
      "type": "object",
      "required": [
        "device_id",
        "display_name",
        "status",
        "identity_status",
        "protocol_mode",
        "last_seen",
        "collected_at",
        "stale",
        "expected_fqdn",
        "reported_fqdn",
        "name",
        "type",
        "host",
        "location",
        "online4",
        "online6",
        "extension_version",
        "received_at",
        "hardware",
        "docker",
        "hermes",
        "lucky"
      ],
      "properties": {
        "device_id": {
          "type": "string",
          "pattern": "^[a-z0-9][a-z0-9._-]{0,62}$"
        },
        "display_name": {"type": "string", "minLength": 1, "maxLength": 128},
        "enabled": {"type": "boolean"},
        "ingestion_mode": {"enum": ["legacy", "device_v2", "cutover"]},
        "status": {
          "enum": ["online", "degraded", "stale", "offline", "never_seen", "disabled", "identity_error"]
        },
        "identity_status": {
          "enum": ["matched", "fqdn_mismatch", "missing_fqdn", "unregistered", "disabled", "unknown"]
        },
        "protocol_mode": {"enum": ["legacy_single_device", "device_v2", "none"]},
        "last_seen": {"$ref": "#/$defs/nullableTime"},
        "collected_at": {"$ref": "#/$defs/nullableTime"},
        "stale": {"type": "boolean"},
        "expected_fqdn": {"type": "null"},
        "reported_fqdn": {"type": "null"},
        "name": {"type": "string", "maxLength": 128},
        "type": {"type": "string", "maxLength": 64},
        "host": {"type": "string", "maxLength": 253},
        "location": {"type": "string", "maxLength": 128},
        "online4": {"type": "boolean"},
        "online6": {"type": "boolean"},
        "uptime": {"type": "string", "maxLength": 64},
        "uptime_seconds": {"type": "integer", "minimum": 0, "maximum": 9007199254740991},
        "load_1": {"type": "number"},
        "load_5": {"type": "number"},
        "load_15": {"type": "number"},
        "tcp_count": {"type": "integer"},
        "udp_count": {"type": "integer"},
        "process_count": {"type": "integer"},
        "thread_count": {"type": "integer"},
        "network_rx": {"type": "integer"},
        "network_tx": {"type": "integer"},
        "network_in": {"type": "integer"},
        "network_out": {"type": "integer"},
        "cpu": {"type": "number"},
        "cpu_cores": {"type": "integer"},
        "cpu_model": {"type": "string", "maxLength": 128},
        "memory_total": {"type": "integer"},
        "memory_used": {"type": "integer"},
        "swap_total": {"type": "integer"},
        "swap_used": {"type": "integer"},
        "hdd_total": {"type": "integer"},
        "hdd_used": {"type": "integer"},
        "last_network_in": {"type": "integer"},
        "last_network_out": {"type": "integer"},
        "io_read": {"type": "integer"},
        "io_write": {"type": "integer"},
        "custom": {"type": "string", "maxLength": 1024},
        "os": {"type": "string", "maxLength": 128},
        "extension_version": {"const": "1.0-draft"},
        "received_at": {"type": "string", "format": "date-time", "maxLength": 40},
        "hardware": {
          "$ref": "../docs/migration/schema/agent-update-extension.schema.json#/$defs/hardware"
        },
        "docker": {
          "$ref": "../docs/migration/schema/agent-update-extension.schema.json#/$defs/docker"
        },
        "hermes": {
          "$ref": "../docs/migration/schema/agent-update-extension.schema.json#/$defs/hermes"
        },
        "lucky": {"$ref": "../docs/migration/schema/lucky-extension.schema.json"},
        "easytier": {"$ref": "../docs/migration/schema/easytier-extension.schema.json"},
        "unifi": {"$ref": "../docs/migration/schema/unifi-extension.schema.json"},
        "client_build": {"$ref": "#/$defs/clientBuild"},
        "easytier_expectation": {"$ref": "#/$defs/easytierExpectation"},
        "collection_diagnostics": {"type": "array", "maxItems": 64, "items": {"$ref": "#/$defs/collectionDiagnostic"}},
        "hardware_json": {"type": "string", "maxLength": 262144},
        "docker_json": {"type": "string", "maxLength": 262144},
        "hermes_json": {"type": "string", "maxLength": 262144}
      },
      "additionalProperties": false
    },
    "collectionDiagnostic": {
      "type": "object",
      "required": ["domain", "component", "status"],
      "properties": {
        "domain": {"type": "string", "minLength": 1, "maxLength": 160},
        "component": {"type": "string", "minLength": 1, "maxLength": 160},
        "status": {"enum": ["available", "degraded", "unavailable", "stale", "not_reported", "not_configured", "not_installed", "unsupported", "partial", "not_observed"]},
        "code": {"type": ["string", "null"], "maxLength": 160},
        "field": {"type": ["string", "null"], "maxLength": 160},
        "reason": {"type": ["string", "null"], "maxLength": 160},
        "source": {"type": ["string", "null"], "maxLength": 160},
        "resource": {"type": ["string", "null"], "maxLength": 160},
        "observed_count": {"type": ["integer", "null"], "minimum": 0, "maximum": 4096},
        "displayed_count": {"type": ["integer", "null"], "minimum": 0, "maximum": 64}
      },
      "additionalProperties": false
    },
    "easytierExpectationValues": {
      "type": "object",
      "required": ["administrative_role", "network_name", "overlay_ipv4", "proxy_cidrs"],
      "properties": {
        "administrative_role": {"type": ["string", "null"], "maxLength": 128},
        "network_name": {"type": ["string", "null"], "maxLength": 128},
        "overlay_ipv4": {"type": ["string", "null"], "maxLength": 64},
        "proxy_cidrs": {"type": "array", "maxItems": 16, "uniqueItems": true, "items": {"type": "string", "maxLength": 64}}
      },
      "additionalProperties": false
    },
    "easytierExpectation": {
      "type": "object",
      "required": ["configured", "result"],
      "properties": {
        "configured": {"type": "boolean"},
        "expected": {"$ref": "#/$defs/easytierExpectationValues"},
        "observed": {"$ref": "#/$defs/easytierExpectationValues"},
        "result": {"enum": ["matched", "mismatch", "not_observable", "not_configured"]}
      },
      "additionalProperties": false
    },
    "clientBuild": {
      "type": ["object", "null"],
      "required": ["version", "revision", "build_time", "protocol"],
      "properties": {
        "version": {"type": "string", "minLength": 1, "maxLength": 64, "pattern": "^[^\\u0000-\\u001F\\u007F]+$"},
        "revision": {"type": "string", "pattern": "^[0-9a-f]{40}$"},
        "build_time": {"type": ["string", "null"], "format": "date-time", "maxLength": 40},
        "protocol": {"const": "device_v2"}
      },
      "additionalProperties": false
    },
    "serverBuild": {
      "type": "object",
      "required": ["version", "revision", "build_time", "deployment"],
      "properties": {
        "version": {"type": "string", "minLength": 1, "maxLength": 64, "pattern": "^[^\\u0000-\\u001F\\u007F]+$"},
        "revision": {"type": "string", "minLength": 1, "maxLength": 64, "pattern": "^(?:[0-9a-f]{40}|unknown)$"},
        "build_time": {"type": ["string", "null"], "format": "date-time", "maxLength": 40},
        "deployment": {"enum": ["production", "preview", "staging", "development", "unknown"]}
      },
      "additionalProperties": false
    }
  },
  "$comment": "Stable (registry order, device_id) ordering and per-item serialization isolation are semantic validator requirements. No devices[] property exists."
}
