{
  "schema_version": 2,
  "generated_at": "2026-07-01T12:00:00Z",
  "default_device_id": "device-beta",
  "servers": [
    {
      "extension_version": "1.0-draft",
      "received_at": "2026-07-13T12:00:01Z",
      "hardware": {
        "cpu_model": null,
        "cpu_temperature": null,
        "disk_temperature": null,
        "disk_smart_status": "unknown",
        "disk_power_on_hours": null,
        "disk_written_bytes": null,
        "disk_read_bytes": null,
        "disk_device": null,
        "disk_smart_source": null,
        "updated_at": null,
        "stale": true,
        "error": null
      },
      "docker": {
        "running": 0,
        "total": 0,
        "limit": 0,
        "truncated": false,
        "containers": [],
        "updated_at": "2026-07-13T12:00:00Z",
        "stale": false,
        "error": null
      },
      "hermes": {
        "profiles": [],
        "updated_at": "2026-07-13T12:00:00Z",
        "stale": false,
        "error": null
      },
      "lucky": {
        "status": "not_configured",
        "source": "unavailable",
        "service": {
          "state": "unknown",
          "process_running": null,
          "process_pid": null,
          "uptime_seconds": null,
          "api_reachable": false,
          "web_reachable": false,
          "error": {
            "code": "not_configured",
            "message": "Lucky monitoring is not configured",
            "source": "lucky",
            "retryable": false,
            "http_status": null
          }
        },
        "version": {
          "current": null,
          "latest": null,
          "update_available": null,
          "build_info": null,
          "checked_at": null,
          "stale": true,
          "error": {
            "code": "not_configured",
            "message": "Lucky monitoring is not configured",
            "source": "lucky",
            "retryable": false,
            "http_status": null
          }
        },
        "ip_resolution": {
          "mode": null,
          "resolved_ip_count": 0,
          "ipv4_count": 0,
          "ipv6_count": 0,
          "status": "not_configured",
          "updated_at": null,
          "stale": true,
          "error": {
            "code": "not_configured",
            "message": "Lucky monitoring is not configured",
            "source": "lucky",
            "retryable": false,
            "http_status": null
          }
        },
        "dynamic_dns": {
          "total": 0,
          "enabled": 0,
          "disabled": 0,
          "healthy": 0,
          "error_count": 0,
          "records": [],
          "status": "not_configured",
          "updated_at": null,
          "stale": true,
          "error": {
            "code": "not_configured",
            "message": "Lucky monitoring is not configured",
            "source": "lucky",
            "retryable": false,
            "http_status": null
          }
        },
        "web_services": {
          "total": 0,
          "enabled": 0,
          "disabled": 0,
          "healthy": 0,
          "error_count": 0,
          "services": [],
          "status": "not_configured",
          "updated_at": null,
          "stale": true,
          "error": {
            "code": "not_configured",
            "message": "Lucky monitoring is not configured",
            "source": "lucky",
            "retryable": false,
            "http_status": null
          }
        },
        "port_forwards": {
          "total": 0,
          "enabled": 0,
          "disabled": 0,
          "healthy": 0,
          "error_count": 0,
          "rules": [],
          "status": "not_configured",
          "updated_at": null,
          "stale": true,
          "error": {
            "code": "not_configured",
            "message": "Lucky monitoring is not configured",
            "source": "lucky",
            "retryable": false,
            "http_status": null
          }
        },
        "certificates": {
          "total": 0,
          "valid": 0,
          "expiring": 0,
          "expired": 0,
          "not_yet_valid": 0,
          "invalid": 0,
          "unknown": 0,
          "items": [],
          "status": "not_configured",
          "updated_at": null,
          "stale": true,
          "error": {
            "code": "not_configured",
            "message": "Lucky monitoring is not configured",
            "source": "lucky",
            "retryable": false,
            "http_status": null
          }
        },
        "updated_at": null,
        "stale": true,
        "error": {
          "code": "not_configured",
          "message": "Lucky monitoring is not configured",
          "source": "lucky",
          "retryable": false,
          "http_status": null
        }
      },
      "device_id": "device-beta",
      "display_name": "Synthetic device-beta",
      "status": "never_seen",
      "identity_status": "unknown",
      "protocol_mode": "none",
      "last_seen": null,
      "collected_at": null,
      "stale": true,
      "expected_fqdn": null,
      "reported_fqdn": null,
      "name": "Synthetic device-beta",
      "type": "synthetic",
      "host": "device-beta.example.invalid",
      "location": "fixture",
      "online4": false,
      "online6": false
    }
  ],
  "sslcerts": [],
  "updated": "1782907200"
}
